<?xml version="1.0" encoding="UTF-8" standalone="yes"?>
<Uitestcase xmlns="http://www.supaur.com/testcase">
    <testcase url="https://cdp.dmp-sit.supaur.tech/overview/customer"
              xmlns:xsi="http://www.w3.org/2001/XMLSchema-instance"
              xsi:schemaLocation="http://www.supaur.com/testcase testcase.xsd">
        <!--
        现阶段：参数类型均为String
        type:元素定位类型
        value:定位元素所需要的参数
        handle:切换至第几个页面
        desc：描述（用来打印日志）
        name：元素名称，暂未用到
        timeout:超时时间，暂未用到
        -->
        <test type="xpath"  value="//input[@placeholder='用户名']"  desc="用户名输入框" name="输入用户名" operator="sendKeys" param="15003970273"/>
        <test type="xpath"  value="//input[@placeholder='密码']"  desc="密码输入框" name="输入密码" operator="sendKeys" param="Supaur2021!@#"/>
        <test type="xpath"  value="//button[1]"  desc="登录" name="登录" operator="click" param=""/>
        <test type="xpath" value="//li[text()='增长参谋']" desc="增长参谋" name="增长参谋" operator="click" param=""/>
        <test type="xpath" value="//li/span[text()='活动']" desc="活动" name="活动" operator="click" param=""/>
        <test  value="//li/span[text()='活动']" desc="活动" name="活动" operator="click" param="" type="xpath"></test>
        <test  value="//span[text()='标签管理']"  desc="进入标签管理" handle="1" operator="click" name="" type="xpath"/>

    </testcase>
</Uitestcase>